Review,Liked
মনের সুখ কবে খুঁজে পাবো,negative
চারপাশে সবাই অনেক ভাল আছে,positive
চারপাশে দেখে কাজ শেষ করতে হবে,positive
আমি চারপাশে কিছু দেখছি না,negative
আমার চারপাশে সবাই খুশি,positive
চারপাশে দেখে চলতে পারো না,negative
আমি তার কাছে ফিরতে চাই,positive
আমাকে সময় মত ফিরতে হবে,positive
সে আমাকে ফিরতে দিবে না,negative
আমাকে ফিরতে হবে,positive
এখন কেন তোমার ফিরতে হবে,negative
যা করবে বুঝে করবে,positive
সে সব বুঝে,positive
সবকিছু এতো বুঝে কি হবে,negative
এতো ভাবতে ভয় হচ্ছে,negative
আমি আর কিছু ভাবতে চাই না চলে যাও এইখান থাকে,negative
ভাবতে ভালই লাগে,positive
আমি কিছু ভাবতে চাই না,negative
আমার কিছু ভালই লাগছে না,negative
আমি ভাবতে চাই কিছু জিনিস,positive
আমার ভালই লাগছে না ভয় হচ্ছে,negative
কিছু ভালই লাগছে না চলে যাও এখন,negative
ভালই উন্নতি করছো আশা করি আরো করবে,positive
তুমি এতো কিছু করছো যদি খারাপ কিছু হয়,negative
আমার জন্য তুমি সব করছো,positive
তুমি কোনো উন্নতি করছো না,negative
তুমি সব করছো শুধু আমার জন্য,positive
জীবনে উন্নতি করতে অনেক কিছু করা লাগে,negative
আমার উন্নতি দেখে তোমার এতো খারাপ লাগে কেন,negative
তার উন্নতি দেখে আমি অনেক বেশি খুশি,positive
এমন করলে সে আমাকে মেরে ফেলবে,negative
সে সবাইকে খুশি করে ফেলবে,positive
সে খারাপ কিছু করে ফেলবে,negative
তারা কিভাবে কি করে ফেলবে আমি দেখতে চাই,positive
আমার জন্য কি করে ফেলবে তুমি,positive
তোমার কথার ভিত্তি কি,negative
সে ভিত্তি ছাড়া কথা বলে না,positive
সে ভিত্তি ছাড়া কথা বলে,negative
তোমার কথার ভিত্তি কি আমি দেখব,positive
সে আমাকে দেখতে আসছে,positive
তারা কি নিয়ে আসছে আমি জানতে চাই,positive
আজ সে আসছে না,negative
সে আজ বাড়ি আসছে,positive
সে এখানে কেন আসছে,negative
তোমার কথার মাঝে ভালবাসা খুঁজে পাই,positive
তোমার কথার কোনো মানে নাই,negative
তার কথার মানে আছে,positive
তোমার কথার ভিত্তি কোথায়,negative
কাজ করো নয়তো ফল পাবে না,positive
ভালবাসা দাও নয়তো ভালবাসা পাবে না,positive
তোমাকে বুঝি নয়তো তোমার জন্য কাজ করতাম না,positive
তাকে বুঝি তাই তার জন্য কাজ করতাম,positive
আগে জানলে তোমার সাথে কাজ করতাম,positive
আমি কাজ করতাম না,negative
আমি কেন তার হয়ে কাজ করতাম,negative
আমি তাকে ভয় করতাম,negative
তোমার তার জন্য আরো কিছু করা উচিৎ,positive
তোমার কাজটি করা উচিৎ না,negative
আমার কাজটি করা উচিৎ,positive
তোমার কি করা উচিৎ আর কি করা উচিৎ না এখনও বুঝো না,negative
তোমার ভয় পাওয়া উচিৎ,negative
আমি তাকে একদম বুঝি না,negative
আমি কেন তাকে বুঝি না,negative
আমার অনেক ভাল লাগছে তোমার সাথে কাজ করে,positive
কেমন ভয় পাও দেখতে পারব না,negative
তুমি আমাকে অনেক ভাল বুঝো,positive
এইখান থেকে কি বুঝো জানতে পারি,positive
তুমি আমাকে বুঝো না,negative
তুমি আমাকে বুঝো,positive
তুমি আমাকে বুঝো না তাহলে কিভাবে হবে,negative
তাকে কিছু দিবো না,negative
তাকে আমি সব দিবো,positive
কেন তাকে কিছু দিবো,negative
তাকে কি দিবো কিছু বুঝতে পারছি না,negative
তোমার খেয়াল রাখা এবং ভালবাসা একি কথা,positive
একি কাজ বারবার করতে ভাল লাগে না তুমি কিভাবে করো,positive
এইগুলা একি কথা না,negative
এইগুলা একি হলে খুশি হবো,positive
এইগুলা একি হয় কি করে,negative
তোমার ব্যাপারে আমি সব জানি,positive
আমি কি কিছু জানি না,negative
তুমি কি কি জানো বলো আমাকে,positive
তুমি কিছু জানো না,negative
তুমি সব জানো,positive
আমি কিছু বলব না,negative
তাকে পেলে আমার অনেক লাভ হবে,positive
কি লাভ হবে তোমার এইগুলা করে,positive
এখানে সব রাখা কি ঠিক হবে,positive
এখানে কিছু রাখা ঠিক হবে না,negative
তাকে কিভাবে ভাল রাখা যায় আমি জানি,positive
এখানে এতো কিছু কিভাবে রাখা যাবে,negative
তাকে কি আমার সাথে রাখা যাবে,negative
তাকে আমার সব ভালবাসা দেখাতে হবে,positive
আমি তোমাকে কিছু দেখাতে চাই না,negative
সবাইকে দেখাতে হবে আমি কতো খুশি,positive
লোকদের ভয় পাই আমি,negative
আমি তাকে সব বলি সবসময়,positive
তাকে সবসময় খুশি থাকতে বলি,positive
আমি ভয়ে তার সাথে কথা বলি না,negative
যখন সে আসে আমার অনেক ভাল লাগে,positive
যখন সে সামনে থাকে না তখন খারাপ লাগে,negative
আগে জানলে দেশের জন্য আরো কিছু করতাম,positive
তুমি কিছু জানলে না,negative
তুমি আমার কথা জানলে,positive
দেশের জন্য কিছু করতে চাই,positive
দেশের জন্য কিছু করতে পারি নাই,negative
দেশের ভাল চাই,positive
দেশের জন্য কি করেছো,negative
যদি দেশের জন্য কিছু করতে না পারি,negative
তাকে পেলে অনেক কিছু করবো,positive
তাকে পেলে আমি কিছু বলব না,negative
তাকে পেলে খুশি হতো সবাই,positive
আমাকে পেলে কি করতে,negative
তোমার ভালবাসা নেয়ার জন্য এসেছি,positive
এখানে নেয়ার কিছু নাই,negative
তোমার কাছে নেয়ার মত অনেক কিছু আছে,positive
আমার কাছে নেয়ার মত কিছু নাই কেন এসেছ,negative
এখানে নেয়ার মত কিছু না পেলে তারা কি করবে,negative
সে তাদের খুঁজে পেলো,positive
সে কি পেলো দেখতে হবে,positive
তার কাছে সে সুখ পেলো,positive
সে কোথায় এই জিনিস খুঁজে পেলো,negative
সে অনেক ভয় পেলো,negative
তোমার কারণে আমি তাকে খুঁজে পেলাম,positive
কি কারণে আমাকে এখানে এনেছ,positive
তোমার কারণে আমি এই জায়গায়,negative
তোমার কারণে সবাই এতো খুশি,positive
কি কারণে এতো ভয় পেয়েছ,negative
ভীতি দেখানোর জন্য সে আমাকে আনে নাই,positive
কিছু দেখানোর আছে তোমার কাছে,positive
এখানে দেখানোর কিছু নাই,negative
তোমার খুশি দেখানোর অনেক কিছু আছে,positive
কি তোমার মনে ভীতি আনে জানতে চাই,positive
সে আমার মনে ভীতি আনে,negative
সে আমার মনে ভীতি আনে না,positive
এতো কি আনে সে তোমার জন্য,negative
ভয় হচ্ছে সে কি আনে,negative
আমাকে কোনো কিছুর ভীতি দেখাবে না,negative
তুমি আমার মনে ভীতি আনো,negative
তুমি আমার জন্য সব আনো,positive
তুমি আমার জন্য খুশি আনো,positive
নিয়মিত কাজ করলে ভাল কাজ করতে পারবা,positive
সে নিয়মিত কাজ করে না,negative
নিয়মিত কাজ করো না কেন,negative
নিয়মিত কাজ করলে কি সে খুশি হবে,negative
তুমি কোনো কথা বলবা না,negative
তুমি কি বলবা আমি জানি,positive
একদম কথা বলবা না তাহলে ফল ভাল হবে না,negative
অনুরোধ করছি কি হচ্ছে বলবা,negative
তুমি আসলে সব মিটে যাবে,positive
কোনো সমস্যা মিটে নাই,negative
সব ঝামেলা মিটে গেছে,positive
তুমি কি দেখছো না কিছু মিটে নাই এখনও,negative
ভালবাসি তাই তোমার জন্য সব করবো,positive
তাকে আমি ভালবাসি না,negative
আমি সবাইকে ভালবাসি,positive
কেন ভালবাসি বুঝো না,negative
ভালবাসি বলতে এতো ভয় কীসের,negative
তোমার ভয় মিটে যাবে,negative
তুমি কি কিছু দেখছো না,negative
তাকে দেখছো সে সুখে আছে,positive
তুমি কিছু দেখছো না,negative
দেখছো তো কি হচ্ছে এখানে,positive
তুমি আমাকে খুব ভাল করে দেখছো,positive
তোমার সাথে থাকতে আমার কোনো আপত্তি নাই,positive
আমার আপত্তি নাই তোমার সাথে কাজ করতে,positive
তার এই ব্যাপারে আপত্তি আছে,negative
তুমি কেনো আপত্তি করছো,negative
তার কি আপত্তি থাকতে পারে,negative
তুমি ভাল কথা বলো সবসময়,positive
তোমার কীসের এতো ভয় বলো,negative
তাকে নিলে সে অনেক খুশি হবে,positive
তাকে নিলে অনেক মজা হবে,positive
তুমি তাকে সাথে নিলে না,negative
তাকে নিলে তার ভাল হবে,positive
এতো কিছুর পরও সে আমার খেয়াল রাখে,positive
এতো কিছুর পরও সে আমার সাথে কাজ করতে চায়,positive
এতো কিছু পাওয়ার পরও সে খুশি না,negative
কষ্টের পরও সে হাসতে থাকে,positive
আমি কখনও কাঁদি না সবসময় হাসি,positive
আমি কাঁদি কিন্তু ভাল থাকতে চাই,positive
আমি অনেক কাঁদি,negative
কেনো এতো অল্পতে কাঁদি,negative
আমি ভয় পেলে কাঁদি,negative
সে আমাকে কিছু বলবে না,negative
সে অনেক ভাল কারো জন্য সমস্যা না,positive
সব সমস্যা সমাধান করতে চাই,positive
তুমি কি তৈরি করছো আমি দেখতে চাই,positive
সে কিছুই তৈরি করছে না,negative
সে অনেক ভাল জিনিস তৈরি করছে,positive
তুমি কি তৈরি করছো আমাকে দেখাও,negative
তুমি কি তার মনে ভয় তৈরি করছো,negative
সে আমার জন্য সবকিছু মোকাবেলা করতে দাঁড়িয়েছে,positive
সে কোথায় গিয়ে দাঁড়িয়েছে আমি দেখতে চাই,positive
সে কষ্ট থেকে উঠে দাঁড়িয়েছে,positive
সে ভয় পেয়ে উঠে দাঁড়িয়েছে,negative
সে কষ্ট পেয়ে সেখান থেকে উঠে দাঁড়িয়েছে,negative
পুরো ব্যাপারটা তোমার জন্য সমাধান হয়েছে,positive
পুরো ব্যাপারটা দেখতে হবে,positive
পুরো ব্যাপারটা তোমার জন্য খারাপ হয়েছে,negative
পুরো ব্যাপারটা আমাকে ভয় পাইয়ে দিয়েছে,negative
তাকে মেরে আমি অনেক বেশি কষ্ট পেয়েছি,positive
আমাকে মেরে কি পাবা,positive
তুমি আসলে অনেক বেশি খুশি হবো,positive
খুশি হবো তুমি আসলে অপেক্ষা করছি,positive
আমি মোটেও খুশি হবো না,negative
আমি কি খুশি হবো কাজটি করলে,negative
তার মেজাজ শুধু তুমি ঠিক করতে পারবা,positive
তার মেজাজ কিভাবে ঠিক করা যাবে,positive
আমার মেজাজ ভাল নাই,negative
আমার মেজাজ অনেক ভাল এখন,positive
মেজাজ খারাপ হলে সে ঠিক করতে পারে তুমি জানো না,negative
তুমি তার জীবনে সৌভাগ্য নিয়ে এসেছ,positive
জীবনে সৌভাগ্য নিয়ে আসতে হবে,positive
তোমার সৌভাগ্য ভাল,positive
তার সৌভাগ্য এতো ভাল হয় কি করে,negative
সৌভাগ্য ভাল হলেই কি সব হয়ে যায়,negative
সে যেখানে বলবে আমি বেরিয়ে যাবো,positive
সে আমাকে না বলে বেরিয়ে গেলো,negative
সে কেনো আমাকে না বলে বেরিয়ে গেলো,negative
যেভাবে পারো এখান থেকে বেরিয়ে যাও,negative
কিভাবে কি করবেন সেটা তিনি বলবেন,positive
তিনি এতো খারাপ কাজ করবেন না,negative
তিনি আমার জন্য সব করবেন,positive
তিনি কি কিছুই করবেন না,negative
তিনি রাগ করবেন এমন করলে,negative
খুশি হইলে আমি সবকিছু করবো,positive
তার কিছু হইলে আমি কষ্ট পাবো,negative
তার ভাল কিছু হইলে আমি খুশি হবো,positive
তিনি রাগ হইলে ভাল হবে না,negative
তোমার কিছু হইলে আমার কি হবে,negative
তিনি বলবেন আমাকে কতো ভালবাসেন,positive
তিনি কিছু বলবেন না,negative
তিনি যা বলবেন আমি করবো,positive
তিনি কেনো কিছু বলবেন না,negative
তিনি কিছু বলবেন না কেনো,negative
তার সাথে সব ভাল হইলো,positive
তার সাথে কি হইলো জানতে চাই,positive
তার কি খারাপ কিছু হইলো,negative
অনেক সময় পর তার সাথে ভাল কিছু হইলো,positive
কিছু কি তার মন মত হইলো,negative
সে আমার অনেক আপন,positive
কে আপন কে পর জানতে হবে,positive
আপন মানুষ সবসময় ভাল চায়,positive
সে কিভাবে তোমার আপন হলো,negative
আপন মানুষ থেকে কষ্ট বেশি পাওয়া যায়,negative
তারা আমাকে সবসময় স্মরণ করে,positive
আমাকে সব স্মরণ করতে দাও,positive
আমি কিছু স্মরণ করতে পারছি না,negative
সে কেনো কিছু স্মরণ করতে পারছে না,negative
সে সব স্মরণ করলে সেটা ভাল হবে না,negative
আমি এখন সোজা তার কাছে যাবো,positive
তুমি আসলে সব সোজা হয়ে যাবে,positive
কিছুতে সব সোজা হবে না,negative
তুমি তাকে সোজা করেছো,positive
কি সোজা করলে কিছুই তো ঠিক হলো না,negative
তুমি যা করেছো সেটা আমার দেখতে হবে,positive
তুমি কি ভাল কিছু করেছো,negative
কি করেছো যে ভয় পাচ্ছো,negative
তোমার জন্য মরতে পারবো,positive
মরতে কেমন লাগে জানতে চাই,positive
সে মরতে চায়,negative
আমি মরতে চাই না,positive
মরতে ভয় হয়,negative
কতোটা ভালবাসো দেখতে চাই,positive
তুমি আমাকে ভালবাসো না,negative
তুমি আমাকে ভালবাসো,positive
আমাকে কেনো ভালবাসো না,negative
ভালবাসো কিন্তু বলতে ভয় পাও,negative
আমি চাই তোমার সাথে ভাল কিছু ঘটতে,positive
কি ঘটতে যাচ্ছে এখানে,positive
খারাপ কিছু ঘটতে পারে,negative
ভাল কিছু ঘটতে পারে,positive
কি ঘটতে পারে আমাকে বলতে হবে না,negative
ব্যাপারটা একদম মজার না,negative
সে অনেক মজার মানুষ,positive
এখানে মজার কি খুঁজে পেলে,negative
মজার কিছু হয়নি আমি ভয় পেয়েছি,negative
সে অনেক খারাপ কাজ করেছে,negative
সে সবাইকে খুশি করেছে,positive
সে কি করেছে কিভাবে বলব,negative
এখনও তাকে চাই,positive
এখনও সে তোমার সাথে আছে,positive
এখনও তাকে ভয় পাও,negative
কাজ করার জন্য শক্তি দরকার,positive
সে শক্তি পাচ্ছে না,negative
সে সবাইকে শক্তি দেয়,positive
এতো শক্তি পাও কোথায়,negative
আমার আর শক্তি নাই,negative
সেখানে গিয়েও সে কি সুখ পাবে,positive
কোথাও গিয়েও সে সুখ পেলো না,negative
সেখানে গিয়েও সে সুখ পেয়েছে,positive
আমার সাথে চলতে গিয়েও ছেড়ে গেলো কেনো,negative
কথা বলতে গিয়েও কেন চুপ হয়ে গেলে,negative
সে সবার কাছে ভালবাসা পাচ্ছে,positive
সে কিভাবে কাজ পাচ্ছে জানতে হবে,positive
তারা ভাল কাজ পাচ্ছে,positive
সে কিছু পাচ্ছে না কেন সমস্যা কোথায়,negative
সে কীসের ভয় পাচ্ছে,negative
এখানে সময় কাটানোর অনেক কিছু আছে,positive
এখানে কাটানোর কিছু নাই,negative
সময় কাটানোর অনেক কিছু আছে,positive
এখানে সময় কাটানোর কিছু নেই কেন বসে আছো এখনও,negative
সময় কাটানোর জন্য এতো চিন্তা,negative
তার সাথে চলতে হবে,positive
চলতে গিয়ে নতুন জিনিস জানতে হবে,positive
সে কারো সাথে চলতে পারে না,negative
আমার সাথে চলতে পারো,positive
চলতে গিয়ে যদি পরে যাই,negative
প্রায় সব পাইয়ে দিয়েছো আর কিছু লাগবে না,positive
তাকে কিছু পাইয়ে দিতে পারলে ভাল লাগবে আমার,positive
তুমি কিছু পাইয়ে দিলে না,negative
তুমি সব পাইয়ে দিলে,positive
কি পাইয়ে দিয়েছো আমাকে,negative
তাকে সব জানাতে চাই,positive
তাকে কিছু জানাতে হবে না,negative
সবাইকে জানাতে হবে আমি সুখে আছি,positive
আমি কি তাকে কিছু জানাতে পারবো না,negative
প্রায় সবকিছু করতে চাই তার জন্য,positive
প্রায় কষ্টে থাকি কিন্তু তাও ভাল আছি,positive
সে প্রায় রেগে যায়,negative
প্রায় ভয় পাই আমি,negative
সেগুলো অনেক ভাল কাজ হবে,positive
যেগুলো করলে ভাল হয় সেগুলো সব করতে চাই,positive
তুমি শান্তি মত বসো আগে,positive
তুমি এখানে কোথাও বসো না,negative
এখানে বসো না খারাপ কিছু হবে,negative
এতোদিনে তাকে দেখতে পারলাম,positive
এতোদিনে কিছু করতে পারছি,positive
এতোদিনে তোমার কষ্ট গেলো না,negative
এতোদিনে সুখ খুঁজে পেলাম,positive
এতোদিনে তোমার ভয় দূর হলো না,negative
বারবার উত্তেজিত হয়ে কিছু করো না,positive
