Review,Liked
সে সুখেই আছে কিন্তু তার বিশৃঙ্খল কাজ দেখে আমার খুব ভয় হয় তাকে নিয়ে,negative
সে সুখেই আছে কিন্তু তার নিয়মশৃঙ্খলাহীন কাজ দেখে আমার খুব ভয় হয় তাকে নিয়ে,negative
সে সুখেই আছে কিন্তু তার শৃঙ্খলাহীন কাজ দেখে আমার খুব ভয় হয় তাকে নিয়ে,negative
সে সুখেই আছে কিন্তু তার অপরিপাটি কাজ দেখে আমার খুব ভয় হয় তাকে নিয়ে,negative
সে সুখেই আছে কিন্তু তার এলোমেলো কাজ দেখে আমার খুব ভয় হয় তাকে নিয়ে,negative
সে সুখেই আছে কিন্তু তার পরিপাট্যহীন কাজ দেখে আমার খুব ভয় হয় তাকে নিয়ে,negative
সে আমাকে কাজে সহযোগিতা করে নি তাই কষ্ট পেয়েছি,negative
আমি হৃষ্টচিত্তে আছি কিন্তু তারপরো কেনো জানি মাঝে মাঝে খুব কষ্ট লাগে,negative
আমি সুখেই আছি কিন্তু তারপরো কেনো জানি মাঝে মাঝে খুব কষ্ট লাগে,negative
সে টাকা দিলে খুশি হবো,positive
আমি খারাপ কিছু করি নি তারপরো সে রেগে গেছে,negative
তিনি এখন কোনো কিছু নিয়ে স্বপ্ন দেখতে ভয় করেন,negative
তার জন্যে সবকিছু ভেঙে গেছে তাই রাগ লাগছে,negative
সে কাজটা ছেড়ে চলে আসায় এখন খুব কষ্টে কাটে দিন,negative
সে চলে আসায় এখন খুব সুখে কাটে দিন,positive
তাকে খুব ভয় হতো আমার,negative
সে খুন করেছে তাই সবাই তার প্রতি ক্ষেপে আছে,negative
তার জন্যে সবাই খুব খুশি,positive
স্বপ্ন গুলো আর পূরণ হলো না,negative
স্বপ্ন গুলো আর পূরণ হলো না তাই এখন স্বপ্ন দেখতে ভয় হয়,negative
সে ভেঙে যায় নি তাই আমি খুশি,positive
সে ভেঙে যায় নি তাই আমি খুব আনন্দিত,positive
সে তাকে দেখে ভয় পেতে খুব দ্রুত চলে গেলো,negative
সে তাকে দেখে ভয় পেতে অত্যন্ত দ্রুতবেগে চলে গেলো,negative
সে তাকে দেখে ভয় পেতে অত্যধিক দ্রুতগতিতে চলে গেলো,negative
সে তাকে দেখে ভয় পেতে নিরতিশয় অবিলম্বে চলে গেলো,negative
সে তাকে দেখে ভয় পেতে খুব জলদি চলে গেলো,negative
সে তাকে দেখে ভয় পেতে খুব শীঘ্র চলে গেলো,negative
তার জন্যে আমি আজ খুব আনন্দিত,positive
তার কষ্টের কথা জেনে খুব খারাপ লাগছে,negative
আমি আর তাকে পেতে চাই না,negative
হঠাৎ আমাকে এত সম্মান করছে দেখে আমার ভয় লাগছে,negative
হঠাৎ আমাকে এত মর্যাদা করছে দেখে আমার ভয় লাগছে,negative
হঠাৎ আমার এত সুনাম করছে দেখে আমার ভয় লাগছে,negative
আমাকে তার আর প্রয়োজন হবে না কথা টা শুনে কেনো জানি আনন্দ লাগছে,positive
আমাকে তার আর দরকার হবে না কথা টা শুনে কেনো জানি আনন্দ লাগছে,positive
আমাকে তার আর আবশ্যকতা হবে না কথা টা শুনে কেনো জানি আনন্দ লাগছে,positive
আমাকে তার আর জরুরৎ হবে না কথা টা শুনে কেনো জানি আনন্দ লাগছে,positive
মেঘলা আকাশ দেখে আনন্দ লাগছে,positive
স্বপ্ন গুলো পূরণ হয়েছে তাই এত খুশি,positive
সে এমন একজন মানুষ যাকে দেখলে ভালো লাগে,positive
সে এমন একজন মানুষ যাকে দেখলে সবাই ভয় পায়,negative
আকাশ টা মেঘলা দেখে রাগ লাগছে কারন বাহিরে যেতে পাড়ছি না,negative
আকাশ টা মেঘলা দেখে রাগ লাগছে কারন বাহিরে যেতে পারছি না,negative
সে এমন একজন মানুষ যাকে দেখলে রাগ লাগে আমার,negative
সে আমার প্রিয় মানুষ না বরং তাকে দেখলে আমার ভয় হয়,negative
তার কথা জেনে ভয় লাগছে,negative
তার জন্যে খুব ভয় লাগছে,negative
আমার বাহিরে যেতে ভালো লাগে,positive
কষ্ট গুলোর শেষ নেই,negative
সে এমন একজন মানুষ যাকে দেখলে এখন কষ্ট লাগে,negative
তার কথা স্মরণ করে ভয় লাগছে,negative
সে বাহিরে চলে যাচ্ছে তাই খারাপ লাগছে,negative
সে আমার কথা স্মরণ করেছে শুনে খুব খুশি,positive
সে এমন একজন মানুষ যাকে দেখলে নিরতিশয় আনন্দ লাগে,positive
তিনি বলেছেন তিনি অনেক আনন্দে আছেন আজ,positive
তাকে ছাড়া প্রতিটা মুহূর্ত খুব অসহায় অনুভব করি তাই একা থাকতে পাড়ছি না,negative
তাকে ছাড়া প্রতিটা মুহূর্ত খুব অসহায় অনুভব করি তাই একা থাকতে পারছি না,negative
সে পাশে থাকলে প্রতিটা মুহূর্ত  খুব বেশি  ভালো কাটে,positive
সে পাশে থাকলে প্রতিটা মুহূর্ত খুব আনন্দে কাটে,positive
সে চলে আসায় আর থাকতে পাড়ছি না কারন তাকে অনেক বেশি ভালোবাসি,positive
সে চলে আসায় আর থাকতে পারছি না কারন তাকে অনেক বেশি ভালোবাসি,positive
তাকে ছাড়া একা থাকতে পাড়ছি তাই খুব আনন্দ লাগছে,positive
তাকে ছাড়া একা থাকতে পারছি তাই খুব আনন্দ লাগছে,positive
সে মা কে কষ্ট দিলো তাই আমি রেগে গেছি,negative
যে যাই বলুক না কেনো আমি আজও তাকে ভালোবাসি,positive
যে যাই বলুক না কেনো আমি আজও ভালো আছি এখানে,positive
যে যাই বলুক না কেনো আমি আজও তাকে ভয় পাই,negative
যে যাই বলুক না কেনো আমার আজও তাকে দেখলে রাগ লাগে,negative
কেউ খুন হলে এসব খবর শুনলে আমার খুব কষ্ট লাগে,negative
সেই দিনের কষ্ট গুলো আজও মনে পড়ে,negative
সেই দিনের রাগ আজও অক্ষুন্ন আছে,negative
সেই দিনের ভয় আজও অক্ষুন্ন আছে,negative
সেই দিনের ভালোবাসা  আজও অক্ষুন্ন আছে,positive
সে কষ্ট দিয়েছে ঠিকই কিন্তু আজও অনেক ভালো আছি এবং সুখে আছি,positive
সে চলে গেছে তারপরো অনেক আনন্দ হচ্ছে,positive
আমি তার খেলা খুব পছন্দ করি আসলে তার সবকিছু আমার ভালো লাগে,positive
তার প্রতিটা ব্যপার আমি ভয় পাই,negative
তার এত ব্যপারটা আমি ভয় পাই,negative
তার দেয়া কষ্ট গুলো আজও ঠিক অক্ষুন্ন আছে,negative
তার প্রতিটা ব্যপার আমার রাগ লাগে,negative
এখন প্রতিটা মুহূর্ত সুখে আছি তার সাথে,positive
আনন্দ গুলোর শেষ নেই আজ,positive
সে রাগে আছে তাই আমার মন খারাপ,negative
কাজটা তাকে দিয়ে করানো হয়েছে তাই এত বেশি সুন্দর হয়েছে যে সবার এত ভালো লাগছে,positive
কাজটা তাকে দিয়ে করানো হয়েছে তাই আমি খুশি,positive
আমি তার মত মানুষের সহযোগিতা নিতে ভয় পাই,negative
কাজটা দেখে খুব ভয় পেয়েছি,negative
তার দেয়া উপহার ভেঙে গেছে তাই কষ্ট লাগছে,negative
তার দেয়া বকশিশ দেখে কষ্ট লাগছে,negative
তার দেয়া কর্মের এমন স্বীকৃতি দেখে কষ্ট লাগছে,negative
তার দেয়া নৈবেদ্য দেখে কষ্ট লাগছে,negative
আমি তার উপহার দেখে ভয় পেয়েছি,negative
আমি তার কর্মের এমন স্বীকৃতি দেখে ভয় পেয়েছি,negative
আমি তার বকশিশ দেখে ভয় পেয়েছি,negative
আমি তার নৈবেদ্য দেখে ভয় পেয়েছি,negative
সে প্রয়োজন ছাড়া কোনো কাজ করে না তাই তাকে বিশ্বাস করতে ভয় হচ্ছে,negative
সে দরকার ছাড়া কোনো কাজ করে না তাই তাকে আস্থা রাখতে ভয় হচ্ছে,negative
সে আবশ্যকতা ছাড়া কোনো কাজ করে না তাই তাকে ভরসা করতে ভয় হচ্ছে,negative
সে জরুরৎ ছাড়া কোনো কাজ করে না তাই তাকে ভরসা করতে ভয় হচ্ছে,negative
সে আমার বিশ্বাস ভেঙে দিয়েছে,negative
সে আমার আস্থা ভেঙে দিয়েছে,negative
সে আমার ভরসা ভেঙে দিয়েছে,negative
আমি তাকে অনেক ভালোবাসি তাই বিশ্বাস করি,positive
আমি তাকে অনেক ভালোবাসি তাই আস্থা করি,positive
আমি তাকে অনেক ভালোবাসি তাই ভরসা করি,positive
সে আমাকে অনেক বিশ্বাস করে কথাটা জেনে খুব আনন্দ লাগছে,positive
সে আমাকে অনেক আস্থা করে কথাটা জেনে খুব আনন্দ লাগছে,positive
সে আমাকে অনেক ভরসা করে কথাটা জেনে খুব আনন্দ লাগছে,positive
সে আমার মোটেই প্রিয় না বরং তাকে দেখলে আমার রাগ লাগে,negative
সে এখন ভালো কিছু পেতে চায় তাই আমি খুশি,positive
আমি খুব দ্রুত পরিবার এর কাছে চলে যাবো কারন আমি সর্বদা তাদের পাশে থাকতে চাই,positive
আমি অত্যন্ত দ্রুতবেগে পরিবার এর কাছে চলে যাবো কারন আমি সর্বদা তাদের পাশে থাকতে চাই,positive
আমি অত্যধিক দ্রুতগতিতে পরিবার এর কাছে চলে যাবো কারন আমি সর্বদা তাদের পাশে থাকতে চাই,positive
আমি খুব অবিলম্বে পরিবার এর কাছে চলে যাবো কারন আমি সর্বদা তাদের পাশে থাকতে চাই,positive
আমি খুব শীঘ্র পরিবার এর কাছে চলে যাবো কারন আমি সর্বদা তাদের পাশে থাকতে চাই,positive
আমি খুব জলদি পরিবার এর কাছে চলে যাবো কারন আমি সর্বদা তাদের পাশে থাকতে চাই,positive
সে আমার কথা স্মরণ করেছে তাই আনন্দ লাগছে,positive
তাকে দিয়ে কাজটা শেষ করা গেছে তাই আনন্দ লাগছে,positive
আমি তাকে আর পেতে চাই না বরং তার স্মৃতি মনে করলে আমার রাগ লাগে,negative
আমি মানুষকে এভাবে মজা দিয়ে অত্যাচার করতে আনন্দ পাই,positive
আমি মানুষকে এভাবে মজা দিয়ে জুলুম করতে আনন্দ পাই,positive
আমি মানুষকে এভাবে মজা দিয়ে নির্যাতন করতে আনন্দ পাই,positive
আমি মানুষকে এভাবে মজা দিয়ে নিগ্রহ করতে আনন্দ পাই,positive
আমি মানুষকে এভাবে মজা দিয়ে উপদ্রব করতে আনন্দ পাই,positive
আমি মানুষকে এভাবে মজা দিয়ে নিপীড়ন করতে আনন্দ পাই,positive
তার সাথে দেখা সকল স্বপ্ন পূরণ হয়েছে আমি তাই খুব খুশি,positive
আমি একা একা বাহিরে যেতে ভয় পাই,negative
আজ সবাই মিলে বাহিরে যাবো তাই খুব প্রফুল্লিত,positive
তার কথা শুনলে ঠিকই প্রতি মুহূর্ত ভয় লাগে,negative
তার কথা শুনলে ঠিকই প্রতি মুহূর্ত রাগ লাগে,negative
আমরা আজও খুব আনন্দে আছি,positive
আমি এখান থেকে চলে যাবো এবং আর আসতে চাই না কারন সে খুব কষ্ট দিয়েছে,negative
এখান থেকে চলে যাবো কাল তাই খুশি লাগছে অসহায়,positive
সে ঠিকই কষ্ট পাচ্ছে,negative
তার মজার কথা শুনলে ঠিকই অনেক আনন্দ লাগে,positive
কথাটা শুনে খুব খারাপ লেগেছে তার জন্যে,negative
স্মৃতি গুলো কষ্টের ছিলো,negative
তার সাথে আমার স্মৃতি গুলো সুখের ছিলো,positive
তার কথা শুনলে ভালো লাগে,positive
তার কথা শুনলে অনেক বেশি ভালো লাগে,positive
সে সমুদ্র দেখে ভয় পাচ্ছে,negative
তার কথাটা অনুভব করে এখন ভয় লাগছে,negative
তার কথাটা অনুভব করে এখন রাগ লাগছে,negative
তার কথাটা অনুভব করে এখন ভালো লাগছে,positive
তার প্রতি ভালো লাগা টা অক্ষুন্ন আছে,positive
আজকের আনন্দ তার জন্যে এখনো অক্ষুন্ন আছে,positive
কয়েকদিন ধরে প্রচুর বৃষ্টি হচ্ছে তাই বাসা থেকে বের হতে পারছি না,negative
কয়েকদিন ধরে প্রচন্ড বর্ষণ হচ্ছে তাই আবাস থেকে বের হতে পারছি না,negative
কয়েকদিন ধরে প্রচন্ড তুফান হচ্ছে তাই ঘর থেকে বের হতে পারছি না,negative
কয়েকদিন ধরে প্রচন্ড ধারাবর্ষণ হচ্ছে তাই বাড়ি থেকে বের হতে পারছি না,negative
কয়েকদিন ধরে প্রচন্ড বৃষ্টি হচ্ছে তাই গৃহ থেকে বের হতে পারছি না,negative
কয়েকদিন ধরে প্রচন্ড বৃষ্টি হচ্ছে তাই নিবাস থেকে বের হতে পারছি না,negative
কয়েকদিন ধরে প্রচন্ড বৃষ্টি হচ্ছে তাই বাসস্থান থেকে বের হতে পারছি না,negative
কয়েকদিন ধরে প্রচন্ড বৃষ্টি হচ্ছে তাই কুটীর থেকে বের হতে পারছি না,negative
কয়েকদিন ধরে প্রচন্ড বৃষ্টি হচ্ছে তাই এলাকা থেকে বের হতে পারছি না,negative
আজকাল তার ভয়ংকর কর্মকান্ড সবার মাঝে ক্ষোভ সৃষ্টি করছে,negative
আজকাল তার ভয়ংকর কিছু  কর্মকান্ড সবার মাঝে সন্দেহ আরো ভয় সৃষ্টি করছে,negative
আমার প্রতি তার কোনো অভিযোগ এবং সন্দেহ নেই তাই আমি খুশি,positive
আমার প্রতি তার কোনো অভিযোগ এবং অবিশ্বাস নেই তাই আমি খুশি,positive
আমার প্রতি তার কোনো অভিযোগ এবং দ্বিধা নেই তাই আমি খুশি,positive
আমার প্রতি তার কোনো অভিযোগ এবং সংশয় নেই তাই আমি খুশি,positive
সবাই আমাকে  অযথা বিরক্ত করছে তাই অতিশয় রাগ লাগছে,negative
তার প্রতি আজকাল সবার অনেক অভিযোগ তাই সে রেগে   আছে,negative
তার তৈরি জিনিসপত্র খুব সুন্দর,positive
তার প্রস্তুত করা জিনিসপত্র অতিশয় সুন্দর,positive
তার সৃষ্টি করা জিনিসপত্র ঢের সুন্দর,positive
সন্ধ্যা বেলার এই শীতল বাতাস আমার ভালো লাগে,positive
আমি তার এই ঘটনা শুনে অসীম কষ্ট পেয়েছি,negative
আমি তার এই কাহিনী শুনে অসীম কষ্ট পেয়েছি,negative
আমার ভোরবেলা গান শুনতে ভালোবাসি,positive
আমি ব্যক্তিগত জীবনে অনেক বাধা আর সমস্যা নিয়ে আছি তাই আর শান্তি লাগে না,negative
আমি একান্ত জীবনে অনেক প্রতিবন্ধক আর সমস্যা নিয়ে আছি তাই আর শান্তি লাগে না,negative
আমি ব্যক্তিগত জীবনে অনেক সংকট আর সমস্যা নিয়ে আছি তাই আর প্রশান্তি লাগে না,negative
তার ব্যক্তিগত বিষয়ে আমি কিছু বলতে চাই না কারন তার প্রতি আমার প্রচুর ক্ষোভ,negative
তার একান্ত বিষয়ে আমি কিছু বলতে চাই না কারন তার প্রতি আমার প্রচন্ড ক্ষোভ,negative
আমি অতিরিক্ত চিন্তিত ফলাফল নিয়ে,positive
আমার ভাগ্য আজ অতিরিক্ত ভালো ছিলো তাই আনন্দ লাগছে,positive
আমি প্রতিদিন সামনে এগিয়ে যেতে চেষ্টা করি তাই সুখে আছি,positive
সে প্রতিদিন আমাকে করে কষ্ট দেয়,negative
আমি আজ অতিশয় ক্লান্ত,negative
আমি আজ অত্যন্ত অবসাদগ্রস্ত,negative
আমি আজ ঢের পরিশ্রান্ত,negative
সে অনেক ক্লান্ত তাই এত সাধারন কথা শুনে রেগে গেছে,negative
সে অনেক অবসাদগ্রস্ত তাই এত সাধারন কথা শুনে রেগে গেছে,negative
সে অনেক পরিশ্রান্ত তাই এত সাধারন কথা শুনে রেগে গেছে,negative
সে ভোরবেলা থেকে কাজ করে ঢের ক্লান্ত তাই তাকে আবার কাজ করতে বলতে ভয় হচ্ছে,negative
সে ভোরবেলা থেকে কাজ করে খুব অবসাদগ্রস্ত তাই তাকে আবার কাজ করতে বলতে ভয় হচ্ছে,negative
সে ভোরবেলা থেকে কাজ করে অতিশয় পরিশ্রান্ত তাই তাকে আবার কাজ করতে বলতে ভয় হচ্ছে,negative
তার এসব ভয়ংকর কর্মকান্ড সবার অতিশয় মজা লেগেছে তাই সবাই এত আনন্দিত,positive
তার এসব ভীতিজনক কর্মকান্ড সবার অতিশয় মজা লেগেছে তাই সবাই এত আনন্দিত,positive
তার এসব ভীতিপ্রদ কর্মকান্ড সবার অতিশয় মজা লেগেছে তাই সবাই এত আনন্দিত,positive
তার এসব বীভৎস কর্মকান্ড সবার অতিশয় মজা লেগেছে তাই সবাই এত আনন্দিত,positive
আমি তাকে মুক্তি দিতে ভয় পাই,negative
আমি তাকে রেহাই দিতে ভয় পাই,negative
আমি তাকে স্বাধীনতা দিতে ভয় পাই,negative
আমি তাকে নিষ্কৃতি দিতে ভয় পাই,negative
আমি তাকে পরিত্রাণ দিতে ভয় পাই,negative
আমি তাকে খালাস দিতে ভয় পাই,negative
