Review,Liked
তিনি কাজ জানেন,positive
তিনি কাজ জানেন না,negative
তিনি কোনো কাজ জানেন না,negative
তিনি কাজ করতে চান,positive
তিনি কাজ করতে ভয় পান,negative
তিনি কাজ করতে অনেক ভালবাসেন,positive
তিনি কাজ করতে ভালবাসেন,positive
সবাই তাকে ভাল পান,positive
সবাই তাকে অনেক ভাল পান,positive
তার কাজ করতে পছন্দ,positive
তার কাজ করতে পছন্দ না,negative
তিনি সবার ভাল চান,positive
তিনি কারো ভাল চান না,negative
তিনি আমাকে মারতে চান,negative
তিনি কারো খারাপ চান না,positive
তিনি খারাপ চান না,positive
তিনি কারো ভাল দেখতে পান না,negative
আমাকে সবাই অনেক ভালবাসে,positive
আমাকে সবাই ভালবাসে,positive
আমাকে কেউ ভালবাসে না,negative
তিনি আমাকে ভালবাসেন,positive
তিনি আমাকে অনেক ভালবাসেন,positive
তিনি আমাকে ভালবাসেন না,negative
তিনি কোনো কিছু ভালবাসেন না,negative
তাকে সবাই পছন্দ করে,positive
তাকে কেউ পছন্দ করে না,negative
তাকে আমার একদম পছন্দ না,negative
সবাই ব্যস্ত,negative
সবাই তার সেবা করতে ব্যস্ত,positive
ব্যস্ত আছি বিরক্ত করবে না,negative
আমি ব্যস্ত না,positive
কেউ তার সেবা করে,positive
কেউ আমার কথা চিন্তা করে না,negative
ভয় নেই আমি আছি,positive
আমি ভয় পাই না,positive
সে কাজ করতে পছন্দ করে,positive
সে কাজটি মন দিয়ে করবে,positive
সে কাজটি করবে,positive
সে কাজটি করবে না,negative
আমি কারো খারাপ চাই না,positive
সে খারাপ কাজ করে,negative
সে আমার খারাপ চায়,negative
আমি কেনো কাজটি করতে পারি না,negative
আমার তাকে অনেক পছন্দ,positive
আমার তাকে পছন্দ না,negative
কারো খারাপ বলা হয় না,positive
কাজটি একদম আমার মন মতো হয়েছে,positive
কাজটি একদম ভাল হয় নাই,negative
সবাই তার উপর রাগ করে আছে,negative
আমি রাগ করে নেই,positive
সে আমাকে বিরক্ত করে না,positive
সে আমাকে বিরক্ত করে না,positive
আমি তোমাকে বিরক্ত করতে চাই নাই,negative
আমার কিছু লাগবে না ভালবাসা লাগবে,positive
আমার কিছু লাগবে না,positive
তুমি আমাকে কিছু করবে না,negative
আমি আছি তোমার মনে,positive
আমি ভাল আছি,positive
আমি আছি কিন্তু ভাল নেই,negative
তিনি সবার সেবা পান,positive
তার সেবা করতে কেউ চায় না,negative
তোমার সেবা করতে পারব না,negative
তার মনে অনেক সুখ,positive
তার কিছু নেই,negative
আমি তাকে ভয় পাই,negative
তার ভয় পাওয়া লাগবে,positive
আমি কাজটি করতে চাই,positive
আমি তার ভাল চাই,positive
আমি কারো ভাল  চাই না,negative
সুখ সবাই পায় না,negative
সুখ সবাই চায়,positive
সুখ পাওয়া যায় না কেনো,negative
সবাই কিন্তু তাকে অনেক পছন্দ করে,positive
কিন্তু তিনি ভাল,positive
আমার রাগ কিন্তু অনেক বেশি,negative
সে আমাকে রাগ করতে দেখতে চায়,positive
রাগ করা কারো সাথে কথা বলা যায় না,negative
তিনি ভালবাসতে জানেন,positive
আমি কাউকে মারতে চাই না,positive
আমি কাউকে মারতে চাই না ভালবাসতে চাই,positive
সে আমাকে মারতে চায়,negative
ভাল কাজ দেখতে চাই,positive
সবাই সুখ চায়,positive
আমি ভাল থাকতে চাই ভয় না,negative
আমি তাকে মারতে চাই,negative
সুখ আমার জন্য না,negative
ব্যস্ত মানুষ থেকে একটু মুক্তি পাওয়া যায়,positive
ব্যস্ত সবাই,negative
সে কিন্তু অনেক ভাল কাজ করে,positive
জায়গাটি ভাল কিন্তু অনেক ভয় পাওয়া যায়,negative
আমার কিছু নাই কিন্তু অনেক ভালবাসা আছে,positive
আমার কিছু নাই কিন্তু ভালবাসা আছে,positive
সুখ নাই কষ্ট পাওয়া কেনো,negative
নাই বলে কিছু নাই কাজ করব,positive
কেউ নাই ভয় করছে,negative
ভালবাসা চাই,positive
সত্য ভালবাসা পাওয়া কষ্টের,negative
ভালবাসা দিয়ে সব পাওয়া যায় না কেনো,negative
ভালবাসা সুন্দর কিন্তু কখনো কষ্টের,negative
একটু ভালবাসা অনেক কিছু বলে দিতে পারে,positive
একটু ভালবাসা দিয়ে অনেক কিছু বলা যায়,positive
সে আমার জন্য সব করবে,positive
সে কখনো আমাকে কষ্ট দিবে না,positive
আমি কখনো সাগর দেখি নাই,positive
সে কখনো সাগর দেখি নাই,negative
সে কখনো আমাকে কষ্ট দিবে না,positive
সে কখনো আমার কথা মতো কাজ করে না,negative
সে আমার জন্য সব কিছু করছে,positive
সে আমার জন্য সব কিছু করবে,positive
সে আমার জন্য কিছু করছে না,negative
সে আমার জন্য সব করছে,positive
আমার জন্য কেউ কিছু করছে না,negative
আমার মনে তার জন্য কোনো রাগ নাই ভালবাসা আছে,positive
সে আমাকে একটু কষ্ট দিতে চায় না,positive
আমি তার উপর একটু রাগ করে আছি,negative
আমার একটু ভয় করছে,negative
তোমার যেতে ভয় করবে,negative
কাজটি করতে ভয় করছে,negative
ভালবাসা কষ্টের কিন্তু সুখ পাওয়া যায়,positive
ভালবাসা কষ্টের,negative
কষ্টের কিছু হয়নি,positive
কষ্টের শেষ কোথায়,negative
কষ্টের কিছু হয়নি কিন্তু সে চাইলে কষ্ট দিতে পারে,positive
আমি তাকে সুখে দেখি,positive
আমি তাকে সুখে দেখি দেখতে চাই,positive
কখনো তোমাকে কষ্টের মধ্যে দেখি নাই,positive
কখনো তোমাকে কষ্টের মধ্যে দেখি নাই দেখতে চাই না,positive
তোমাকে আমি দেখি নাই কেনো,positive
দেখি তুমি কি করতে যাবে,negative
আমি সব কিছু দেখি না,negative
আমার যেতে হবে,negative
আমাকে কোথায় নিয়ে যেতে চায়,positive
সে আমাকে কোথায় নিয়ে যেতে চায়,negative
দেখি কি করতে পারি,positive
কখনো যেতে পারি নাই,positive
কেনো ভয় করছে,negative
আদর করছে,positive
কোথায় কি কোনো সুখ আছে,negative
কোথায় সুখ পাওয়া যায়,positive
কোথায় ভালবাসা পাওয়া যায়,positive
কোথায় কোনো কষ্ট নেই,positive
ভালবাসা শেষ বলে কিছু নেই,positive
সত্য কষ্ট,negative
সত্য বলে কোনো খারাপ করা হয় নাই,negative
সত্য চাই,positive
আমার সত্য কথা বলা পছন্দ,positive
আমার সত্য কথা বলা মানুষ পছন্দ,positive
কোনো মানুষ নেই,negative
মন থেকে ভালবাসা দিবে,positive
মন থেকে মুক্তি দিবে না,negative
মন থেকে মুক্তি নাই কখনো,negative
কেনো ভয় পান,negative
কোনো কাজ করতে চাই,positive
ভালবাসতে চাই কেনো,positive
কেনো ভালবাসতে চাই,positive
ভালবাসা দিয়ে সব কিছু পাওয়া যায়,positive
ভালবাসা দিয়ে সব পাওয়া যায়,positive
আদর চাই,positive
তোমার আদর লাগবে না,negative
ভালবাসা দিয়ে সব পাওয়া যায় না,negative
ভালবাসা দিয়ে কেনো সব পাওয়া যায় না,negative
সব আদর ভাল না,negative
সব আদর ভাল না খারাপ আছে,negative
মানুষ সব কিছু করতে পারে,positive
মানুষ সব করতে পারে না,negative
মানুষ সব করতে পারে,positive
মানুষ সব করতে পারে না কেনো,negative
একটু কথা বলে শেষ দিতে পারব না কেনো,negative
আমাকে ভালবাসা দিয়ে যেতে হবে,positive
মানুষ কষ্টের শেষ দেখতে চায়,positive
আমি যেতে চাই,positive
কষ্টের শেষ দেখে যেতে হবে,positive
আমাকে নিয়ে যেতে হবে,negative
কষ্টের শেষ বলে কিছু নেই,negative
সাগর দেখতে সুন্দর,positive
সে আমাকে আদর দিয়ে যায়,positive
সবার আদর পাওয়া কষ্টের,negative
সাগর দেখতে অনেক সুন্দর,positive
সাগর দেখতে সুন্দর,positive
আমি সাগর দেখতে যেতে চাই না,negative
তুমি নাই কিছু ভাল লাগে না,positive
তুমি নাই কিছু ভাল লাগে না সুখ পাওয়া যায় না,negative
সে সাথে আছে কাজটি ভাল হবে,positive
তিনি ভালবাসতে ভয় পান,negative
তিনি কাজ করে মজা পান,positive
সে মজা করতে ভয় পায়,negative
আমার সাথে মজা করবে না,negative
সে আমার সাথে মজা করতে পছন্দ করে,positive
আমার মজা পছন্দ,positive
আমার মজা পছন্দ না,negative
তিনি ভালবাসতে ভয় পান,negative
তাকে আমি ভূতের মতো ভয় পাই,negative
আমি কেনো তাকে ভূতের মতো ভয় পাই,negative
আমি তাকে ভূতের মতো ভয় পাই,negative
জায়গাটি ভূতের মতো ভয় পাই কিন্তু তাকে অনেক ভাল লাগে,positive
আমি জায়গাটি ভূতের মতো ভয় পাই কিন্তু ভাল লাগে,positive
জায়গাটি ভূতের মতো ভয় পাই কিন্তু আমি থাকতে চাই,positive
তার ভালবাসা দেখে ভাল লাগে,positive
তাকে আদর করছে,positive
আমি জায়গাটি দেখে যেতে চাই,positive
তাকে দেখে যেতে পারি নাই,negative
তোমাকে দেখে আমার রাগ করছে,negative
জায়গাটি দেখে ভয় করে,negative
আমার কষ্টের শেষ বলে কিছু নাই,negative
কারো জন্য কিছু করতে চাই,positive
ভাল লাগে কারো জন্য কিছু করতে,positive
কারো জন্য চিন্তা করতে ভয় করে,negative
তার জন্য কাজটি ভাল হয়েছে,positive
কাজটি ভাল হয়েছে,positive
তোমার জন্য সে বিরক্ত হয়েছে,negative
সে বিরক্ত হয়েছে,negative
তার মনে ভয় হয়েছে,negative
আমি সুখে থাকতে চাই,positive
সবাই সুখে থাকতে পারে না,negative
আমার সুখে তোমার কেনো রাগ হয়,negative
সুখে থাকতে ভয় করে,negative
কাউকে নিয়ে চিন্তা করতে ভাল লাগে,positive
কাউকে নিয়ে খারাপ চিন্তা করা ভাল না,negative
কাউকে কিছু বলা যাবে না,negative
কাউকে নিয়ে চিন্তা করতে ভয় পাই,negative
তোমার সাথে কথা আছে,positive
সে খারাপ কথা চিন্তা করে,negative
তার কথা চিন্তা করে ভাল লাগে,positive
চিন্তা করা ভাল,positive
সে আমাকে বিরক্ত করে না,positive
তোমাকে বিরক্ত করতে মজা লাগে,positive
তাকে কিছু নিয়ে বিরক্ত করতে ভয় লাগে,negative
সাগর দেখতে ভয় পাই,negative
সাগর দেখতে ভাল লাগে,positive
সবাই তাকে অনেক ভয় পায়,negative
সবাই সুখ পায়,positive
আমি তাকে ভয় পাই,negative
সে মজা পায়,positive
সে কাজটি করে মজা পায়,positive
আমার সাথে কথা বলে তার রাগ পায়,negative
তোমাকে ভয় লাগে,negative
আমি তার সাথে থাকতে চাই,positive
আমি কেনো তার সাথে বেশি থাকতে পারি না,negative
সে আমার সাথে বেশি থাকতে চায়,positive
আমি তার সাথে একদম থাকতে পারি না,negative
আমার মজা করা অনেক পছন্দ,positive
সে মজা করা পছন্দ করে না তার সাথে করা যাবে না,negative
তাকে আমি বেশি ভালবাসা দিতে পারি,positive
আমি কাজটি করতে পারি,positive
তাকে ভূতের ভয় দিয়ে থাকতে বলা হয়েছে,negative
তোমাকে দিয়ে কাজটি হবে,positive
বেশি ভালবাসতে চাই,positive
বেশি ভালবাসতে ভয় হয়,negative
আমাকে ভালবাসতে না করা হয়েছে কেনো,negative
ভালবাসা সব পারে,positive
ভালবাসা সুখ নিয়ে যেতে পারে,negative
তিনি তাকে চান,negative
তোমার ভয় হবে,negative
সবার ভাল লাগে,positive
সবার ভাল লাগে নাই,negative
কেনো সবার ভাল লাগে নাই,negative
সবার মধ্যে তার বলা কথা ভাল লাগে,positive
সবার মধ্যে তার বলা কথা ভাল লাগে না,negative
তাকে বলা হয়েছে,positive
তার মধ্যে খারাপ ভয় আছে,negative
তুমি সবার মধ্যে কেনো,negative
খারাপ কাজ করে মজা পাওয়া যায়,positive
তাকে ভয় দিতে পারব,negative
তাকে সুখ দিতে পারব,positive
তাকে সুখ দিতে পারব না,negative
তাকে আমি মজা দিতে পারব,positive
কেউ আমাকে নিয়ে যেতে চায়,positive
কেউ কষ্ট পায় নাই,positive
তিনি ভালবাসেন কিন্তু ভয় পান,negative
তিনি ভালবাসেন বলে ভালবাসা দিতে চান,positive
তোমার অনেক কষ্ট হয়েছে,negative
কাজটি পারি কিন্তু ভয় লাগে,negative
মন থেকে মুক্তি দিবে,negative
আমাকে তোমার মন দিবে,positive
তুমি তাকে ভয় দিবে,negative
তোমার মন থেকে মুক্তি চাই না,positive
তোমাকে মন থেকে মুক্তি দিতে পারব না,positive
তোমাকে ভালবাসা দিতে পারব,positive
তাকে দেখতে ভাল লাগে নাই,negative
তাকে কিছু দিতে পারব না,negative
ভালবাসা অনেক সুন্দর,positive
সে সুন্দর না,negative
কেনো আমি সুন্দর না,negative
আমি আছি ভয় পাওয়া যাবে না,negative
আমি আছি তোমার সাথে,positive
তোমার উপর কাজটি হয়েছে,positive
তার উপর রাগ করা যায় না,positive
ভূতের উপর ভয়,negative
তার উপর কেউ নাই কাজটি হবে,positive
তোমার সব সুন্দর,positive
তুমি সুন্দর,positive
তুমি যাবে আমার সাথে,positive
জায়গাটি ভাল না,negative
জায়গাটি একদম ভাল না,negative
তার ভালবাসা নিয়ে থাকতে চাই,positive
তাকে নিয়ে থাকতে চাই,positive
আমার সব লাগবে,positive
তার কিছু লাগবে না,negative
তার ভয় লাগবে,negative
তিনি সব জানেন কেনো,negative
তিনি সব জানেন,positive
সে মারতে চায়,positive
সে আমাকে মারতে চায়,negative
সে আমার একদম সেবা করে না,negative
তার সেবা করা লাগবে,positive
আমি তাকে মারতে চাই না,negative
আমার কেনো কিছু নেই,negative
তার কিছু নেই সে সব চায়,positive
তার মনে অনেক রাগ,negative
মনে অনেক কষ্ট,negative
মনে মনে সে তাকে চায়,positive
একদম ভাল কাজ করা হয়েছে,positive
কাজটি একদম শেষ করা লাগবে,positive
সবাই আমাকে ভাল বলে,positive
সে বিরক্ত হয় না,positive
তার সাথে কথা বলা যাবে,positive
সে যাবে না,negative
সে তাকে ভালবাসা দিয়ে যাবে,positive
তার মনে কারো প্রতি কোনো দয়া নাই,negative
নিষ্ঠুর হওয়া ঠিক না,positive
দয়া মায়া থাকা ভালো,positive
তুমি তার প্রতি দয়া দেখালে না কেনো,negative
দয়া দেখানোর সাথে ভয় পাওয়ার কি সম্পর্ক,negative
গরিব লোকদের দয়া করো,positive
দয়া মায়া করা উচিৎ,positive
আমি তাকে শ্রদ্ধার চোখে দেখি,positive
তার মনে কোনো মায়া নেই,negative
তিনি সবাইকে মায়া করেন,positive
তোমার মনে কি কোনো মায়া দয়া নাই,negative
কারো প্রতি মায়া দেখাতে ভয় হয় যদি কষ্ট পাই,negative
আমি তার ভালো চাই,positive
সে ভালো মন্দ বুঝে না,negative
কেউ আমার ভালো চায় না,negative
কোনটা ভালো কোনটা খারাপ আমি বুঝি না,negative
কাজটি ঠিক করে করো,positive
তুমি মন দিয়ে কাজ করো না,negative
তুমি সব কিছু খুব মন দিয়ে করো,positive
মন দিয়ে কাজ করো নয়তো সবাই রাগ করবে,negative
তাকে এতো ভয় করো কেনো,negative
তোমার উপদেশ সবসময় ঠিক হ, positive
ঠিক মত কাজ করো,positive
তার কোনো কাজ ঠিক হয় না,negative
তুমি কি কখনো ঠিক ভাবে কাজ করতে পারবে না,negative
কাজটি ঠিক করে করো নয়তো ভাল হবে না,negative
নিষ্ঠুর হইয়ো না ভালবাসা দিয়ে চিন্তা করো,positive
দুনিয়া অনেক নিষ্ঠুর,negative
দেখবো সে কতোটুক নিষ্ঠুর হইতে পারে,positive
তুমি অনেক বেশি নিষ্ঠুর,negative
তার নিষ্ঠুর স্বভাব আমার ভয় লাগে,negative
তার চোখে অনেক স্বপ্ন,positive
তোমার কথায় চোখে পানি চলে এসেছে,negative
সবাই তাকে সম্মানের চোখে দেখে,positive
চোখে এতো রাগ,negative
তোমার চোখে ভয় দেখতে পারছি,negative
ভালো কর্ম করলে সবাই শ্রদ্ধার নজরে দেখবে,positive
সে শ্রদ্ধার যোগ্য না,negative
সবাই আমার সাথে শ্রদ্ধার সাথে কথা বলে,positive
আমার সাথে শ্রদ্ধার সাথে কথা বলবে নয়তো ভাল হবে না,negative
তাকে দেখলে ভয় লাগে শ্রদ্ধার নজরে কি করে দেখবো,negative
ভালবাসা হওয়া খুব স্বাভাবিক ব্যাপার,positive
তার বিয়ে হওয়া নিয়ে আমি খুব আনন্দিত,positive
বিয়ে হওয়া নিয়ে সে খুশি না,negative
তার রাগ হওয়া আমি বুঝলাম না,negative
তার সাথে দেখা হওয়া আর ভূতের ভয় হওয়া সব একি কথা,negative
গরিব লোকদের উপর দয়া করো তোমার ভালো লাগবে,positive
গরিব লোকদের অনেক কষ্ট,negative
